<?xml version="1.0"?>
<Pedido xmlns="http://www.miempresa.org/pedidos" xmlns:xsi="http://www.w3.org/2001/XMLSchema-instance" 
xsi:schemaLocation="http://www.miempresa.org/pedidos Ejercicio3.xsd" fecha="2022-10-06">
    <Destino>
        <Nombre>fsdds</Nombre>
        <Direccion>fassa</Direccion>
        <Ciudad>dsas</Ciudad>
        <CodPostal>1001</CodPostal>
    </Destino>
    <Ordenante>
        <Nombre>fsdds</Nombre>
        <Direccion>fassa</Direccion>
        <Ciudad>dsas</Ciudad>
        <CodPostal>1001</CodPostal>
    </Ordenante>
    <Observaciones>dsa</Observaciones>
    <Contenido>
        <Producto codigo="999-AA">
                <Nombre>asasa</Nombre>
                <Cantidad>50</Cantidad>
                <Precio>0.99</Precio>
                <Observaciones>adssa</Observaciones>

        </Producto>
    </Contenido>
</Pedido>
